ID,nextID,name,speaker,Textbox_type,Text_KR,Text_EN,Text_JP,Stage
100001,100002,에스트,10101,0,…,...,...,Tutorial_cg1
100002,0,에스트,10101,0,낯선 천장…,A strange ceiling...,見慣れない天井…,Tutorial_cg1
100003,100004,시드,10201,0,안녕.,Hi there.,こんにちは。,Tutorial_cg1
100004,100005,에스트,10101,0,"아니, 얼굴이네.","Wait, it's a face.",いや、顔か。,Tutorial_cg1
100005,0,에스트,10101,0,…우와.,...Wow.,…うわぁ…。,Tutorial_cg1
100006,100007,시드,10201,0,…,...,...,Tutorial_cg1
100007,100008,에스트,10101,0,안… 녕?,He...llo?,…こんにちは？,Tutorial_cg1
100008,100009,시드,10201,0,별로 놀라지 않네?,You're not that surprised?,あんまり驚かないんだね？,Tutorial_cg1
100009,100010,에스트,10101,0,뭔가 외계인이 있지 않을까라고 생각을 하며 살긴 했었거든.,I’ve always assumed aliens were out there.,なんか、外界人とかいるんじゃないかなって思って生きてきたんだよね。,Tutorial_cg1
100010,100011,시드,10201,0,난 외계인이 아니야.,I'm not an alien.,僕は外界人じゃない。,Tutorial_cg1
100011,100012,에스트,10101,0,어…음…그렇구나. 귀여우니까 이해해 볼게! ,"Uh... okay. You're cute, so I'll let it slide.",あ…うーん…そうなんだ。可愛いから、納得してあげる！,Tutorial_cg1
100012,100013,에스트,10101,0,넌 이름이 뭐야?,What's your name?,君の名前は？,Tutorial_cg1
100013,100014,시드,10201,0,난 시드야.,I'm Seed.,僕はシード。,Tutorial_cg1
100014,100015,시드,10201,0,정원의 관리자를 맡고 있어.,I'm the guardian of the garden.,庭園の管理を任されているんだ。,Tutorial_cg1
100015,0,에스트,10101,0,정원? 이 큰 나무 말이야?,Garden? You mean this giant tree?,庭園？ この大きな木のこと？,Tutorial_cg1
100016,100017,시드,10201,0,맞아. 이제 넌 우리의 정원 관리를 도와야 해.,"Exactly. And now, you're going to help us manage it.",そうだよ。これからは君が僕たちの庭園管理を手伝ってくれる番だね。,Tutorial_cg1
100017,100018,에스트,10101,0,엥? 내가? 왜?,Huh? Me? Why?,え？ 僕が？ どうして？,Tutorial_cg1
100018,100019,시드,10201,0,행복나무가 널 데려왔으니까.,Because the Tree of Happiness brought you here.,「幸せの木」が君を連れてきたからだよ。,Tutorial_cg1
100019,100020,에스트,10101,0,이 큰 나무 이름이 행복나무야?,So this huge tree is the Tree of Happiness?,この大きな木の名前が「幸せの木」なの？,Tutorial_cg1
100020,100021,시드,10201,0,아니.,No.,ううん。,Tutorial_cg1
100021,0,시드,10201,0,이 아래의 나무가 행복나무야.,The one right under there is the Tree of Happiness.,この下の木が「幸せの木」だよ。,Tutorial_cg1
100022,0,에스트,10101,0,바닥에 비친 이 큰 나무가…진짜였다고?,So... the huge tree reflected on the ground was the real one?,床に映ったこの大きな木が…本物だったなんて？,Tutorial_cg1
100023,0,시드,10201,0,맞아. 여긴 이런 곳이야.,That’s right. That’s how this place is.,そうだよ。ここはそういう場所なんだ。,Tutorial_cg1
100024,100025,에스트,10101,0,으악!,Whoa!,うわっ！,Tutorial_cg1
100025,100026,에스트,10101,0,내 몸이 변했어!,My body... it's changing!,体が変わっちゃった！,Tutorial_cg1
100026,0,시드,10201,0,행복나무의 공간으로 온 거야.,You’ve entered the space of the Happiness Tree.,「幸せの木」の空間に来たんだよ。,Tutorial_cg1
100027,100028,시드,10201,0,너도 금방 익숙해질 거야,You’ll get used to it soon.,君もすぐに慣れるはずさ。,Tutorial_cg1
100028,100029,시드,10201,0,몸은 좀 어때?,How does your body feel?,体の調子はどうだい？,Tutorial_cg1
100029,100030,에스트,10101,0,좀 당황스럽네.,I’m a bit lost here.,ちょっと戸惑ってるよ。,Tutorial_cg1
100030,100031,에스트,10101,0,음… 사실 무슨 일이 있었는지 전혀 기억이 안 나!,"Um... actually, I don’t remember anything that happened at all!",うーん…実は何があったのか、全然思い出せなくて！,Tutorial_cg1
100031,100032,에스트,10101,0,이게 말로만 듣던 기억상실증이란 걸까?,"Is this that ""amnesia"" people talk about?",これが噂に聞く記憶喪失ってやつかな？,Tutorial_cg1
100032,0,에스트,10101,0,그 외에는 방금 일어나서 그런지 좀 나른한데 괜찮아!,"Other than that, I feel a bit drowsy since I just woke up, but I'm fine!",それ以外は、さっき起きたばかりだからか、ちょっと体がだるいけど大丈夫だよ！,Tutorial_cg1
100033,100034,시드,10201,0,…,...,...,Tutorial_cg1
100034,100035,시드,10201,0,그렇다면 다행이야.,"Well, that's a relief.",…それならよかった。,Tutorial_cg1
100035,0,시드,10201,0,"그럼, 이제 일을 시작해 보자.","Then, let’s get to work.",じゃあ、そろそろ仕事を始めようか。,Tutorial_cg1
100036,0,에스트,10101,0,잠깐! 아직 이해가 안 된 게 있어!,Wait a minute! I still don't get it. ,ちょっと待って！ まだ納得できてないことがあるよ！,Tutorial_cg1
100037,100038,에스트,10101,0,행복나무가 날 데려온 게 왜 내가 일을 해야 할 이유야?,Why does the Tree of Happiness bringing me here mean I have to do this?,「幸せの木」が僕を連れてきたことが、どうして仕事をすべき理由になるの？,Tutorial_cg1
100038,100039,시드,10201,0,…네가 행복을 바라서 행복 나무가 널 데려온 거야.,"Because you wished for happiness, and the Tree of Happiness brought you here.",…君が幸せを願ったから、「幸せの木」が君を連れてきたんだ。,Tutorial_cg1
100039,100040,에스트,10101,0,…혹시 꿈꾸는 거야?,Am I dreaming?,…もしかして夢でも見てるの？,Tutorial_cg1
100040,100041,시드,10201,0,그럴 리가. 잠시 우리를 도와주러 네가 오게 된 거지.,Not at all. You’ve just come here to help us for a while.,そんなわけないだろ。しばらく僕たちを手伝うために、君がここに来たんだよ。,Tutorial_cg1
100041,0,시드,10201,0,정 이유가 필요하다면…,If you really need a reason... ,どうしても理由が必要なら…,Tutorial_cg1
100042,100043,시드,10201,0,"우리의 일을 도와주다 보면, 이곳에서 나가게 도와줄게.","help us with our work, and we’ll help you find a way out of here.",僕たちの仕事を手伝ってくれたら、ここから出られるようにしてあげるよ。,Tutorial_cg1
100043,100044,시드,10201,0,이유가 됐을까?,Is that reason enough?,これじゃ理由になるかな？,Tutorial_cg1
100044,100045,에스트,10101,0,…어…그래. 알았어.,...Uh... yeah. Okay.,…あ…うん、わかったよ。,Tutorial_cg1
100045,0,시드,10201,0,좋아. 따라와..,Good. Follow me.,よし。ついてきて。,Tutorial_cg1
100046,100047,시드,10201,0,제법 몸놀림이 좋네.,You're pretty nimble.,なかなか身のこなしがいいね。,Tutorial_cg2
100047,100048,에스트,10101,0,당연하지! 이래 보여도 운동을 좀 했었거든!,"Of course! I’ve done some sports, you know!",当たり前だよ！ こう見えても、少しは運動してたんだから！,Tutorial_cg2
100048,100049,에스트,10101,0,근데 뭔가 엄청 높이 뛸 수 있게 된 것 같아.,But I feel like I can jump really high now.,でも、なんかすごく高く跳べるようになったみたい。,Tutorial_cg2
100049,100050,시드,10201,0,이 세계의 존재는 다 그래. 좋은 거야.,Everything in this world is like that. It's a good thing.,この世界の存在はみんなそうだよ。いいことだね。,Tutorial_cg2
100050,100051,시드,10201,0,"아무것도 모를 테니까, 최대한 간단하게 설명할게.","Since you probably don't know anything, I'll keep it simple.",何も知らないだろうから、できるだけ簡単に説明するね。,Tutorial_cg2
100051,100052,에스트,10101,0,응!,Okay!,うん！,Tutorial_cg2
100052,0,시드,10201,0,시드콩?,Seed-B?,シードビーン？,Tutorial_cg2
100053,100054,시드콩,10301,0,콩!,Be-Bean!,ビーン！,Tutorial_cg2
100054,100055,에스트,10101,0,!,!,!,Tutorial_cg2
100055,100056,에스트,10101,0,시드가…둘? 그런데 크기가 좀 작네?,There’s... two of you? But you’re so small.,シードが…二人？ でも、サイズがちょっと小さいね？,Tutorial_cg2
100056,100057,시드,10201,0,둘보다 많아. 하지만 우리는 모두 하나야.,More than two. But we are all one.,二人より多いよ。だけど、僕たちはみんな一つなんだ。,Tutorial_cg2
100057,100058,에스트,10101,0,분신술 같은 건가?,Is it like a shadow clone jutsu?,分身術みたいなもの？,Tutorial_cg2
100058,100059,시드,10201,0,…비슷해.,…Something like that.,…似たようなものさ。,Tutorial_cg2
100059,0,시드,10201,0,아무튼 간단히 설명할게.,"Anyway, I’ll explain briefly.",とにかく、簡単に説明するね。,Tutorial_cg2
100060,0,시드,10201,0,"위에 있는 나무의 열매는 밀어서 떨어뜨리고,",Push the fruits from the tree above so they fall down.,上の木の実は押して落として、,Tutorial_cg2
100061,0,시드,10201,0,아래에 있는 나무의 열매는 가운데로 모아주면 돼.,"And for the fruits in the reflection below, gather them to the center.",下の木の実は真ん中に集めてくれればいいんだ。,Tutorial_cg2
100062,100063,에스트,10101,0,그게 전부야? 간단하네!,That’s it? Sounds easy!,それだけ？ 簡単だね！,Tutorial_cg2
100063,100064,시드,10201,0,"맞아. 곳곳에 시드콩이 있을 테니까, 도움받을 수 있을 꺼야.","Right. You’ll find Seed-Bs everywhere, so you can get their help.",そうだよ。あちこちにシードビーンがいるから、助けてもらえるはずさ。,Tutorial_cg2
100064,100065,시드,10201,0,한번 시작해 볼까?,Shall we start?,一度始めてみようか？,Tutorial_cg2
100065,0,에스트,10101,0,응!,Yeah!,うん！,Tutorial_cg2
100066,100067,시드,10201,0,무사히 성공했네. 고생했어.,You did it. Good job.,無事に成功したね。お疲れ様。,Tutorial_cg3
100067,100068,에스트,10101,0,"그럼, 후, 당연하지, 후.","Of course, (huff)... I did, (huff).",もち、ろん、ふぅ、当たり前だよ、ふぅ。,Tutorial_cg3
100068,100069,시드,10201,0,일단 숨 좀 돌리고 말해줘.,Take a breath before you speak.,まずは息を整えてから話して。,Tutorial_cg3
100069,0,에스트,10101,0,"앗, 들켰다.","Oops, caught me.",あ、バレちゃった。 ,Tutorial_cg3
100070,100071,에스트,10101,0,후…,Phew...,ふぅ…,Tutorial_cg3
100071,100072,에스트,10101,0,좋아! 이제 괜찮아졌어!,Okay! I’m good now!,よし！ もう大丈夫だよ！,Tutorial_cg3
100072,100073,시드,10201,0,다행이네.,That’s a relief.,よかった。,Tutorial_cg3
100073,100074,에스트,10101,0,나무가 커서 그런지 열매가 나보다 큰 것 같아.,"Since the tree is so huge, the fruits feel bigger than me.",木が大きいからかな、実が僕より大きい気がするよ。,Tutorial_cg3
100074,100075,에스트,10101,0,근데 왜 위 나무의 열매는 떨어뜨리고 아래 나무의 열매는 안쪽에 모으는 거야?,But why do we drop the fruits from the tree above and gather the ones from the tree below?,ところで、どうして上の木の実を落として、下の木の実は内側に集めるの？,Tutorial_cg3
100075,0,시드,10201,0,…,...,...,Tutorial_cg3
100076,0,시드,10201,0,위 나무의 이름은 슬픔 나무야. 슬픔 나무에는 슬픔이 담긴 열매가 열려.,…The tree above is called the Tree of Sorrow. It bears fruits filled with sadness.,…上の木の名前は「悲しみの木」。悲しみの木には、悲しみが詰まった実がなるんだ。,Tutorial_cg3
100077,0,시드,10201,0,아래 나무의 이름은 행복 나무야. 행복 나무에는 행복이 담긴 열매가 열려.,The tree below is called the Tree of Happiness. It bears fruits filled with joy.,下の木の名前は「幸せの木」。幸せの木には、幸せが詰まった実がなるんだよ。,Tutorial_cg3
100078,100079,에스트,10101,0,아! 그래서 슬픔은 떨어뜨리고 행복은 모으는 거구나!,Ah! So that’s why we drop the sadness and gather the happiness!,あ！ だから悲しみは落として、幸せは集めるんだね！,Tutorial_cg3
100079,100080,시드,10201,0,맞아.,Exactly.,そうだよ。,Tutorial_cg3
100080,100081,에스트,10101,0,그런데 누구의 슬픔과 행복이야?,But whose sadness and happiness are they?,でも、誰の悲しみと幸せなの？,Tutorial_cg3
100081,100082,시드,10201,0,…,...,...,Tutorial_cg3
100082,100083,시드,10201,0,우리의 세상에서 보이는 전부.,Everything visible in our world.,…僕たちの世界から見える、すべて。,Tutorial_cg3
100083,0,에스트,10101,0,응? 그런 게 보여?,Oh? You can actually see that?,えっ？ そんなのが見えるの？,Tutorial_cg3
100084,100085,시드,10201,0,"응, 우리는 늘 보고 있어.",Yes. We are always watching.,うん、僕たちはいつも見ているよ。,Tutorial_cg3
100085,100086,에스트,10101,0,헤… 엄청 많나 보구나.,Heh... I guess there’s a whole lot of it.,へぇ…相当たくさんあるんだね。,Tutorial_cg3
100086,0,에스트,10101,0,"그럼, 이 나무 한 그루가 이 세상의 전부의 감정을 담고 있는 거야?",So this single tree holds all the emotions of the world?,それじゃ、この木一本が、この世界のすべての感情を抱えてるってこと？,Tutorial_cg3
100087,100088,시드,10201,0,예전엔 나무가 아주 많았어. 숲이었지.,There used to be many trees. It was once a forest.,昔は木がたくさんあったんだ。森だったんだよ。,Tutorial_cg3
100088,100089,시드,10201,0,하지만 지금은 모두 시들어서 깊은 잠에 빠졌어.,"But now, they’ve all withered and fallen into a deep sleep.",でも、今はみんな枯れて、深い眠りに落ちてしまった。,Tutorial_cg3
100089,0,시드,10201,0,그래서 이 남은 한그루를 지켜내서 다른 나무들을 깨워야 해.,We must protect this last remaining tree to wake the others.,だから、この残された一本を守り抜いて、他の木たちを目覚めさせなきゃいけないんだ。,Tutorial_cg3
100090,100091,에스트,10101,0,그렇구나. 좋은 일이네! 열심히 힘내볼게!,I see. That’s a good thing! I’ll do my best!,そっか。素敵なことだね！ 精一杯頑張ってみるよ！,Tutorial_cg3
100091,100092,시드,10201,0,고마워.,Thank you.,ありがとう。,Tutorial_cg3
100092,0,시드,10201,0,널 믿고 있어. 에스트,"I’m counting on you, Est.",君を信じているよ。エスト。,Tutorial_cg3
100093,100094,에스트,10101,0,Zzzzz…,Zzzzz…,Zzzzz…,Stage_1
100094,100095,시드콩,10301,0,일어나콩.,Wake up-bean.,起きろビーン。,Stage_1
100095,100096,에스트,10101,0,음냐…아야.,Mmh… Ouch.,うにゃ…痛っ。,Stage_1
100096,0,에스트,10101,0,5분만 더…,Just five more minutes…,あと5分だけ…,Stage_1
100097,100098,시드콩,10301,0,"콩, 콩.","Be-bean, Be-bean.",ビーン、ビーン。,Stage_1
100098,0,에스트,10101,0,…,...,...,Stage_1
100099,100100,에스트,10101,0,으아악! 알았어!!,Argh! Fine!!,…うわぁ！わかったよ！！,Stage_1
100100,0,에스트,10101,0,"일어날게, 시드!","I’m getting up, Seed!",起きるよ、シード！,Stage_1
100101,100102,시드콩,10301,0,난 시드 콩이야콩.,"I’m Seed-B, bean.",僕はシードビーンだビーン。,Stage_1
100102,100103,시드콩,10301,0,다시 일할 시간이야콩.,"It’s time to work, bean.",また仕事の時間だビーン。,Stage_1
100103,0,에스트,10101,0,"아, 맞네. 어쩐지 작더라!","Oh, right. No wonder you were so small!",あ、そうだった。どうりで小さいわけだ！,Stage_1
100104,0,에스트,10101,0,귀여워~,So cute~,可愛い～,Stage_1
100105,100106,시드콩,10301,0,콩…,Be-bean...,ビーン…,Stage_1
100106,0,시드콩,10301,0,그렇다고 일이 사라지지 않아콩.,"That doesn't make the work go away, bean.",だからって、仕事がなくなるわけじゃないビーン。,Stage_1
100107,0,에스트,10101,0,"쳇, 알았어.","Tsk, fine. I get it.",ちぇっ、わかったよ。,Stage_1
100108,0,에스트,10101,0,"우와, 하룻밤 사이에 나무가 더 커졌어…!","Wow, the tree got even bigger overnight…!",うわぁ、一晩で木がもっと大きくなってる…！,Stage_1
100109,100110,시드콩,10301,0,네가 일을 잘해준 덕분이야콩,"It’s all thanks to your hard work, bean.",君がよく働いてくれたおかげだビーン。,Stage_1
100110,100111,시드,10201,0,오늘도 열심히 일해줘.,Keep it up today.,今日も頑張ってくれよビーン。,Stage_1
100111,100112,에스트,10101,0,시드는 말끝에 콩을 안 붙이네?,"Seed, how come you don't say ""bean"" at the end?",シードは語尾にビーンって付けないんだね？,Stage_1
100112,100113,시드,10201,0,…난 대장이니까.,…Because I’m the leader.,…僕は大将だから。,Stage_1
100113,100114,에스트,10101,0,모두 같은 시드인데 대장이 있어?,"You’re all Seeds, but there’s a leader?",みんな同じシードなのに、大将がいるの？,Stage_1
100114,100115,시드,10201,0,"내가 제일 먼저 태어났으니까, 대장이지.",I was the first to be born. That makes me the leader.,僕が一番先に生まれたから、大将なんだよ。,Stage_1
100115,100116,에스트,10101,0,시드는 그런 걸 챙기는 스타일이었구나~,"Heh, I didn't know you cared about that kind of stuff, Seed~",シードって、そういうの気にするタイプだったんだね～。,Stage_1
100116,0,시드,10201,0,"아무튼, 오늘도 잘 부탁해.","Anyway, I’m counting on you today, too.",とにかく、今日もよろしくね。,Stage_1
100117,0,에스트,10101,0,응!,Okay!,うん！,Stage_1
100118,100119,시드,10201,0,"오늘도 고생했어, 에스트. 고마워.","You did a great job today, Est. Thank you.",今日も一日お疲れ様、エスト。ありがとう。,Stage_1
100119,100120,에스트,10101,0,도움이 되었다니 다행이야!,I’m just glad I could help!,役に立てたならよかった！,Stage_1
100120,100121,에스트,10101,0,"그런데 시드, 물어볼 게 있어.","But Seed, I have a question.",ところでシード、聞きたいことがあるんだ。,Stage_1
100121,100122,시드,10201,0,응.,Yes.,うん。,Stage_1
100122,100123,에스트,10101,0,"행복 열매를 흡수하거나, 슬픔 열매가 사라질 때 나오는 말들은 뭐야?",What are those words that pop up when the Happiness fruits are absorbed or the Sorrow fruits disappear?,「幸せの実」を吸収したり、「悲しみの実」が消えるときに出てくる言葉は何？,Stage_1
100123,100124,시드,10201,0,열매는 각 나무의 감정을 먹고 자라나.,The fruits grow by feeding on the emotions of each tree.,実はそれぞれの木の感情を食べて育つんだ。,Stage_1
100124,100125,시드,10201,0,네가 본 글자들은 그 감정이 가진 기억이 표현된 거지.,The words you saw are the memories of those emotions taking form.,"君が見た文字는, その感情が持つ記憶が表現されたものだよ。",Stage_1
100125,100126,에스트,10101,0,…그렇구나.,…I see.,…そっか。,Stage_1
100126,100127,에스트,10101,0,그런데 왜 행복 나무야? 슬픔의 반대는 기쁨 아니야?,"But why is it the ""Tree of Happiness""? Isn't the opposite of Sorrow ""Joy""?",でも、どうして「幸せの木」なの？ 悲しみの反対は「喜び」じゃないの？,Stage_1
100127,0,시드,10201,0,…,...,...,Stage_1
100128,100129,시드,10201,0,기쁨은 행복의 종류 중 하나일 뿐이야.,Joy is just one type of happiness.,喜びは幸せの一種に過ぎないんだ。,Stage_1
100129,100130,시드,10201,0,누군가는 평안함을 행복으로 느껴.,Some people find happiness in peace.,誰かにとっては、安らぎが幸せだったりする。,Stage_1
100130,100131,시드,10201,0,연애를 하는 사람들은 설렘으로 밤을 지새워.,Those in love stay up all night with excitement.,恋をしている人たちは、ときめきで夜を明かしたりもする。,Stage_1
100131,100132,시드,10201,0,"사람들은 “설레서 기쁘다”라고 말하기보단,","People don't usually say, ""I'm joyful because I'm excited.""",人は「ときめいて嬉しい」と言うよりは、,Stage_1
100132,0,시드,10201,0,“설레서 행복해.”라고 말해.,"They say, ""I'm happy because I'm excited.""",「ときめいて幸せ」って言うんだ。,Stage_1
100133,0,시드,10201,0,그 감정들의 종착지는 행복인 거야.,The destination of all those emotions is happiness.,その感情たちの行き着く先は、「幸せ」なんだよ。,Stage_1
100134,0,시드,10201,0,"반면에 슬픔의 종착지는, 슬픔이야.","On the other hand, the destination of sorrow... is just sorrow.",反対に、悲しみの行き着く先は、「悲しみ」だ。,Stage_1
100135,100136,시드,10201,0,슬픔은 회전목마처럼 빙글빙글 돌지.,"Sorrow spins round and round, just like a merry-go-round.",悲しみはメリーゴーランドみたいに、ぐるぐると回るんだ。,Stage_1
100136,0,시드,10201,0,"열매를 덜어내고, 덜어내도, 슬픔 나무는 계속 자라나.","No matter how many fruits we shake off, the Tree of Sorrow keeps growing.",実を減らして、減らしても、悲しみの木は育ち続ける。,Stage_1
100137,100138,시드,10201,0,반면에 행복은 열심히 챙겨줘야 해.,But happiness? You have to take care of it with all your heart.,それに対して、幸せは一生懸命にお世話をしてあげなきゃいけない。,Stage_1
100138,0,시드,10201,0,"열매도 많이 주고, 애정도 열심히 주어야 하지.","You have to give it plenty of fruits, and plenty of love.",実もたくさん作って、愛情もたっぷり注がなきゃ。,Stage_1
100139,100140,에스트,10101,0,…,...,...,Stage_1
100140,0,에스트,10101,0,정말 어렵네. 행복해지는 일은.,"It’s so hard, isn't it? The act of becoming happy.",本当に難しいね。幸せになるっていうのは。,Stage_1
100141,100142,시드,10201,0,그렇게 생각할 수 있지.,You could think of it that way.,そう思うかもしれない。,Stage_1
100142,100143,시드,10201,0,"하지만, 그 과정도 결국 행복해지게 될 거야.",But even that process will eventually become a part of your happiness.,でも、その過程も結局は幸せに繋がっていくはずさ。,Stage_1
100143,100144,시드,10201,0,그러니 우리 같이 노력하자.,"So, let's work on it together.",だから、一緒に頑張ろう。,Stage_1
100144,100145,시드,10201,0,네가 있어서 다행이야.,I’m glad you're here.,君がいてくれてよかった。,Stage_1
100145,0,에스트,10101,0,!,!,!,Stage_1
100146,100147,에스트,10101,0,정말 좋은 말이야! 시드!,"That’s such a beautiful thing to say, Seed!",すごくいい言葉だね！ シード！,Stage_1
100147,0,에스트,10101,0,나도 노력할게!,"I’ll do my best, too!",僕も頑張るよ！,Stage_1
100148,0,에스트,10101,0,"우와, 오늘은 행복나무가 좀 더 크고 풍성한 것 같은데?","Whoa, the Happiness Tree looks even bigger and fuller today!",うわぁ、今日は「幸せの木」がもっと大きくて、ふさふさしてる気がするよ。,Stage_2
100149,100150,시드,10201,0,"맞아, 행복한 감정을 잘 먹고 있나 봐.",Right. It must be eating up all those happy emotions well.,そうだね、幸せな感情をしっかり食べているみたいだ。,Stage_2
100150,100151,에스트,10101,0,나무가 작아지는 일은 없어? 감정을 못 먹는다던가 하는 이유로.,Does the tree never get smaller? Maybe from not eating enough emotions or something.,木が小さくなることはないの？ 感情を食べられないとか、そういう理由で。,Stage_2
100151,100152,시드,10201,0,"응, 없어.","No, it doesn't.",うん、ないよ。,Stage_2
100152,100153,에스트,10101,0,왜?,Why?,どうして？,Stage_2
100153,100154,시드,10201,0,한 번 커진 마음의 크기는 쉽게 줄어들지 않거든.,"Once the heart expands, its size doesn't shrink so easily.","一度大きくなった心の大きさは, そう簡単には縮まないからね。",Stage_2
100154,100155,시드,10201,0,"줄어들었다고 느꼈다면, 오래돼서 무뎌졌거나, 외면하고 있는 거야.","If you felt it had shrunk, it's either grown dull over time, or you're ignoring it.","小さくなったと感じるなら, それは時間が経って鈍くなったか, 目を背けているだけなんだ。",Stage_2
100155,100156,시드,10201,0,"그게 오래되다 보면, 점점 메말라 가는 거지.","If that goes on too long, it gradually starts to wither away.",それが長引くと、だんだん枯れていってしまうんだよ。,Stage_2
100156,100157,에스트,10101,0,정말 심오한 세상이네.,This is a seriously profound world.,本当に奥が深い世界だね。,Stage_2
100157,0,에스트,10101,0,정말 어려워…,It’s really tough…,すごく難しいや…,Stage_2
